<?xml version="1.0" encoding="UTF-8"?>
<root xmlns:xsi="http://www.w3.org/2001/XMLSchema-instance" xsi:noNamespaceSchemaLocation="avscan.xsd">

	<!-- AVG 9.0 -->
	<av name="avg">
		<scanner>
			<exeFileName>avgscanx.exe</exeFileName>
			<cmdLine>
				<avCmd execType="exec"><![CDATA[{%AV_ROOT_PATH%}\avg\avgscanx.exe]]></avCmd>
				<scanFileCmd><![CDATA[/SCAN="%s"]]></scanFileCmd>
				<scanOptions><![CDATA[/HEUR]]></scanOptions>
				<reportCmd><![CDATA[/REPORT="%s\avg_Report.txt"]]></reportCmd>
				<shellLpVerb type="num"></shellLpVerb>
			</cmdLine>

			<reportParser type="logfile">
				<logFileName>avg_Report.txt</logFileName>
			</reportParser>

			<resultParser>
				<resultRegEx>
					<infectedFlag type="bool"><![CDATA[Found[\s]*infections[\s]*:[\s]*([\d])]]></infectedFlag>
					<resultString><![CDATA[{%SCAN_FILE_NAME%}[^\s]*([^\r\n]*)]]></resultString>
					<scanEndFlag><![CDATA[Warnings[\s:\d]*]]></scanEndFlag>
				</resultRegEx>
			</resultParser>
		</scanner>

		<inject>
			<to modName="">
				<func></func>
			</to>
		</inject>

		<updater refreshInMinutes="60">
			<download>
				<url><![CDATA[]]></url>
			</download>
			<updateDir><![CDATA[]]></updateDir>
			<updateCmd><![CDATA[]]></updateCmd>

			<versionInfo>
				<getVerInfo>
					<automation>
					
						<exec type="console" cmd="{%AV_ROOT_PATH%}\avg\avgscanx.exe /SCAN=dummy.exe" getOutput="true">
						<exit/>
						</exec>
					</automation>
				</getVerInfo>

				<verInfoParser>
					<verInfoRegEx>
						<dbVersion><![CDATA[Virus\s*Database:\s*Version\s*([^ ]*)]]></dbVersion>
						<softVersion><![CDATA[Program version\s*([^,]*)]]></softVersion>
						<lastUpdate><![CDATA[Virus\s*Database:\s*Version\s*[^ ]*\s*([^\r]*)]]></lastUpdate>
						<engineVersion><![CDATA[engine\s*([^\r]*)]]></engineVersion>
						<softName></softName>
					</verInfoRegEx>
				</verInfoParser>
			</versionInfo>
		</updater>
	</av>

	<!-- Asquared -->
	<av name="asquared">
		<scanner>
			<exeFileName>a2cmd.exe</exeFileName>
			<cmdLine>
				<avCmd execType="exec"><![CDATA[{%AV_ROOT_PATH%}\asquared\a2cmd.exe]]></avCmd>
				<scanFileCmd><![CDATA[/f="%s"]]></scanFileCmd>
				<reportCmd><![CDATA[/la="%s\asquared_Report.txt"]]></reportCmd>
				<scanOptions><![CDATA[/h /r /a]]></scanOptions>
				<shellLpVerb type="num"></shellLpVerb>
			</cmdLine>

			<reportParser type="logfile">
				<logFileName>asquared_Report.txt</logFileName>
			</reportParser>

			<resultParser>
				<resultRegEx>
					<infectedFlag type="bool"><![CDATA[Found[\s]*Files:[\s]*([\d]*)]]></infectedFlag>
					<resultString><![CDATA[detected:[\s]([^\r\n]*)]]></resultString>
					<scanEndFlag><![CDATA[Scan[\s]*time[\s:\d]*]]></scanEndFlag>
				</resultRegEx>
			</resultParser>
		</scanner>

		<inject>
			<to>
				<func></func>
			</to>
		</inject>

		<updater refreshInMinutes="60">
			<download>
				<url><![CDATA[]]></url>
			</download>
			<updateDir><![CDATA[]]></updateDir>
			<updateCmd><![CDATA[{%AV_ROOT_PATH%}\asquared\a2cmd.exe /u]]></updateCmd>

			<versionInfo>
				<getVerInfo>
					<automation>
						<exec type="console" cmd="{%AV_ROOT_PATH%}\asquared\a2cmd.exe c:\NTDETECT.COM" getOutput="true"/>
						<exit/>

					</automation>
				</getVerInfo>

				<verInfoParser>
					<verInfoRegEx>
						<dbVersion><![CDATA[]]></dbVersion>
						<softVersion><![CDATA[Scanner\s*v\.\s*([^\r]*)]]></softVersion>
						<lastUpdate><![CDATA[Last\s*update:\s*([^\r]*)]]></lastUpdate>
						<engineVersion><![CDATA[]]></engineVersion>
						<softName></softName>
					</verInfoRegEx>
				</verInfoParser>
			</versionInfo>
		</updater>
	</av>

	<!-- ClamAv 0.95 -->
	<av name="clamav">
		<scanner>
			<exeFileName>clamscan.exe</exeFileName>
			<cmdLine>
				<avCmd execType="exec"><![CDATA[{%AV_ROOT_PATH%}\clamav\bin\clamscan.exe]]></avCmd>
				<scanFileCmd><![CDATA["%s"]]></scanFileCmd>
				<reportCmd><![CDATA[--log="%s\clamav_Report.txt"]]></reportCmd>
				<scanOptions><![CDATA[]]></scanOptions>
				<shellLpVerb type="num"></shellLpVerb>
			</cmdLine>

			<reportParser type="logfile">
				<logFileName>clamav_Report.txt</logFileName>
			</reportParser>

			<resultParser>
				<resultRegEx>
					<infectedFlag type="bool"><![CDATA[Infected[\s]files:[\s]*([\d]*)]]></infectedFlag>
					<resultString><![CDATA[{%SCAN_FILE_NAME%}[^\s]*[\s]*([^\s]*)]]></resultString>
					<scanEndFlag><![CDATA[Time[\s:\d.\w()]*]]></scanEndFlag>
				</resultRegEx>
			</resultParser>
		</scanner>

		<inject>
			<to>
				<func></func>
			</to>
		</inject>

		<updater refreshInMinutes="60">
			<download>
				<url><![CDATA[]]></url>
			</download>
			<updateDir><![CDATA[]]></updateDir>
			<updateCmd><![CDATA[{%AV_ROOT_PATH%}\clamav\bin\freshclam.exe"]]></updateCmd>

			<versionInfo>
				<getVerInfo>
					<automation>
						<exec type="console" cmd="{%AV_ROOT_PATH%}\clamav\bin\clamscan.exe -V" getOutput="true"/>
						<fileRead path="C:\Documents and Settings\All Users\.clamwin\db\daily.cvd" startOff="0" length="47"/>
						<fileGetLastModified path="C:\Documents and Settings\All Users\.clamwin\db\daily.cvd" addText="lastUpdate="/>
						<exit/>
					</automation>
				</getVerInfo>

				<verInfoParser>
					<verInfoRegEx>
						<dbVersion><![CDATA[ClamAV-VDB:.*-\d*:([^:]*)]]></dbVersion>
						<softVersion><![CDATA[ClamAV\s*(\d*\.\d*\.\d*)]]></softVersion>
						<lastUpdate><![CDATA[lastUpdate=([^\r]*)]]></lastUpdate>
						<engineVersion><![CDATA[]]></engineVersion>
						<softName></softName>
					</verInfoRegEx>
				</verInfoParser>
			</versionInfo>
		</updater>
	</av>

	<!-- Delete ? -->
	<av name="vba32">
		<scanner>
			<exeFileName>Vba32w.exe</exeFileName>
			<cmdLine>
				<avCmd execType="exec"><![CDATA[{%AV_ROOT_PATH%}\vba32\Vba32w.exe]]></avCmd>
				<scanFileCmd><![CDATA["%s"]]></scanFileCmd>
				<reportCmd><![CDATA[/R="%s\vba32_Report.txt"]]></reportCmd>
				<scanOptions><![CDATA[/SS- /AR+ /SFX+ /RW+ /HA=2 /MR- /BT- /AS- /PM+ /LNG=en]]></scanOptions>
				<shellLpVerb type="num"></shellLpVerb>
			</cmdLine>

			<reportParser type="logfile">
				<logFileName>vba32_Report.txt</logFileName>
			</reportParser>

			<resultParser>
				<resultRegEx>
					<infectedFlag type="bool"><![CDATA[contain[\s]*viruses[\s:\d\-]*infected[\s:\d\-]*infected[\s:]*([\d]*)]]></infectedFlag>
					<resultString><![CDATA[[^\s][\s]*:[\s]*infected[\s]*([^\r\n]*)]]></resultString>
					<scanEndFlag><![CDATA[Total[\s]*time[\s:\d]*]]></scanEndFlag>
				</resultRegEx>
			</resultParser>
		</scanner>

		<inject>
			<to>
				<func></func>
			</to>
		</inject>

		<updater refreshInMinutes="60">
			<download>
				<url><![CDATA[]]></url>
			</download>
			<updateDir><![CDATA[]]></updateDir>
			<updateCmd><![CDATA[]]></updateCmd>

			<versionInfo>
				<getVerInfo>

					<automation>
						<trayDblClk tooltipRegEx="">
							<getText>
								<matchRegEx ifMatch="">
									<sendMsg name="" msg="16" wParam="0" lParam="0">
										<exit/>
									</sendMsg>
								</matchRegEx>
							</getText>
						</trayDblClk>
					</automation>
				</getVerInfo>

				<verInfoParser>
					<verInfoRegEx>
						<dbVersion><![CDATA[]]></dbVersion>
						<softVersion><![CDATA[]]></softVersion>
						<lastUpdate><![CDATA[]]></lastUpdate>
						<engineVersion><![CDATA[]]></engineVersion>
						<softName></softName>
					</verInfoRegEx>
				</verInfoParser>
			</versionInfo>
		</updater>
	</av>

	<!-- Bitdefender 2012 -->
	<av name="bitdefender">
		<scanner>
			<exeFileName>odscanui.exe</exeFileName>
			<cmdLine>
				<avCmd execType="shell"><![CDATA[{D653647D-D607-4df6-A5B8-48D2BA195F7B}]]></avCmd>
				<scanFileCmd><![CDATA["%s"]]></scanFileCmd>
				<reportCmd><![CDATA[]]></reportCmd>
				<scanOptions><![CDATA[]]></scanOptions>
				<shellLpVerb type="num">0</shellLpVerb>
			</cmdLine>

			<reportParser type="reportFromFile">
				<reportFromFile name="C:\Documents and Settings\Administrator\Application Data\Bitdefender\Desktop\Profiles\Logs\*.xml" encoding="" delWhenFinish="true">
					<automation>
						<terminateApp/>
					</automation>
				</reportFromFile>

				<reportFromFileRegEx>
					<infectedFlag type="string"><![CDATA[(threatName=)]]></infectedFlag>
					<scanEndFlag><![CDATA[(</ScanSession>)]]></scanEndFlag>
					<isOurFileFlag><![CDATA[({%SCAN_FILE_NAME%})]]></isOurFileFlag>
					<infected>
						<![CDATA[(threatName="[^"]*")]]>
					</infected>
					<notInfected>
						<![CDATA[ScanFinish]]>
					</notInfected>
				</reportFromFileRegEx>


				<ifAppExit>
					<writeReport>ScanFinish</writeReport>
				</ifAppExit>

				<addToLog><![CDATA[ScanFinish]]></addToLog>

				<winCharacteristics>
					<title><![CDATA[]]></title>
					<class></class>
				</winCharacteristics>

				<logFileName>bitdefender_Report.txt</logFileName>
			</reportParser>

			<resultParser>
				<resultRegEx>
					<infectedFlag><![CDATA[threatName="([^"]*)"]]></infectedFlag>
					<resultString><![CDATA[threatName="([^"]*)"]]></resultString>
					<scanEndFlag><![CDATA[ScanFinish]]></scanEndFlag>
				</resultRegEx>
			</resultParser>
		</scanner>

		<inject>
			<to>
				<func></func>
			</to>
		</inject>

		<updater refreshInMinutes="60">
			<download>
				<url><![CDATA[]]></url>
			</download>
			<updateDir><![CDATA[]]></updateDir>
			<updateCmd><![CDATA[]]></updateCmd>

			<versionInfo>
				<getVerInfo>
					<automation>
						<exec type="shell" clsid="{D653647D-D607-4df6-A5B8-48D2BA195F7B}" lpVerb="0" cmd="c:\dummy.exe">
							<fileGetData path="C:\Documents and Settings\Administrator\Application Data\Bitdefender\Desktop\Profiles\Logs\*.xml" isOurFileFlagRegEx="dummy.exe">
								<regGetValue key="HKLM" path="SOFTWARE\BitDefender\About\ProductName" addText="ProductName="/>
								<regGetValue key="HKLM" path="SOFTWARE\BitDefender\About\ProductVersion" addText="Version="/>
								<exit/>
							</fileGetData>
						</exec>
					</automation>
				</getVerInfo>

				<verInfoParser>
					<verInfoRegEx>
						<dbVersion><![CDATA[totalSignatures="([^"]*)]]></dbVersion>
						<softName><![CDATA[ProductName=([^\r]*)]]></softName>